name,demand,capacity,latency,risk,weight,score,decision,reason
baseline,59,82,19,10,8,136,review,ml utilities baseline scenario exercises the review path for bounded failure handling
pressure,81,68,28,18,9,111,review,ml utilities pressure scenario exercises the review path for bounded failure handling
surge,99,92,23,12,14,226,accept,ml utilities surge scenario keeps the local fixture within the modeled acceptance band
degraded,70,61,33,27,5,15,review,ml utilities degraded scenario exercises the review path for bounded failure handling
recovery,83,108,21,13,11,200,accept,ml utilities recovery scenario keeps the local fixture within the modeled acceptance band
boundary,72,82,20,16,7,127,review,ml utilities boundary scenario exercises the review path for bounded failure handling
